text_id,text
text143,Mitmekülgne ja ennastjuhtiv töötaja on väärtus igale organisatsioonile ning arengu toetamine oluline osa töötaja karjääriteekonna kujundamisest.
text144,"Samuti kirjeldatakse, et virtuaalne juht peaks olema hea suhtleja, algatusvõimeline, paindlik ning demonstreerima õppimis- ja muutumisvõimet."
text145,"„Faktiteadmiste kõrval on üha olulisem õppimise vorm ning oskus erinevates olukordades hakkama saada,“ ütles Laidmets."
text146,"Tegemist on inimesega, kes on avatud muutustele nii koolis kui ka iseendas, alati valmis uuteks väljakutseteks ning leiab võimaluse ka kõige keerulisemate ideede elluviimiseks. "
text147,"72% juhtidest tõi kõige tähtsama tegurina välja oma töötajate kohanemisvõime, valmisoleku uusi oskusi omandada ja liikuda uude tööalasesse rolli. "
text148,"Sagedased muutused tööelus tähendavad ka valmisolekut töö käigus pidevalt uusi oskusi ja teadmisi omandada ning arengueesmärke seada, et suurendada nn karjääri kohanemisvõimet."
text149,"EY Aasta Ettevõtja konkursi patroon president Alar Karis lausus oma videotervituses, et Eesti ettevõtjad on vastupidavad ja sihikindlad, kes oskavad näha ja kasutada uusi võimalusi ka seal, kus teised käega löövad."
text150,"Samuti kirjeldatakse, et virtuaalne juht peaks olema hea suhtleja, algatusvõimeline, paindlik ning demonstreerima õppimis- ja muutumisvõimet."
text151,"Tegelikult on märksa olulisem probleemi lahendamise oskus ja tahe õppida, aga ka julgus eksperimenteerida ja eksida. "
text152,"72% juhtidest tõi kõige tähtsama tegurina välja oma töötajate kohanemisvõime, valmisoleku uusi oskusi omandada ja liikuda uude tööalasesse rolli. "
text153,"Sagedased muutused tööelus tähendavad ka valmisolekut töö käigus pidevalt uusi oskusi ja teadmisi omandada ning arengueesmärke seada, et suurendada nn karjääri kohanemisvõimet."
text154,"On leitud, et kõige enam suurendab töötaja karjääri kohanemisvõimet oskus vastavalt vajadusele kasutada erinevaid enda arendamise viise. Näiteks kogenumatelt kolleegidelt tagasisidet küsides, iseseisvalt infot juurde otsides, võimaluste avanedes täiendus- ja ümberõppes osaledes."
text155,"Lisaks erialasele professionaalsusele toodi kandidaatide juures välja ka rida isikuomadusi, mis on olulised hea tulemuse saavutamiseks - süsteemne tegevus, eesmärgile pühendumine, põhjalikkus, hea suhtlemisoskus, operatiivsus, innovatiivsus, soov end pidevalt erialaselt täiendada”, lausus Ehitusinseneride Liidu tegevdirektor Tiia Ruben."
text156,Ameerika on oma müügioskustelt Euroopast väga palju ees. 
text157,"Palju on juttu sellest, et eestlased pole head müügimehed ning meie müügioskused jätavad pehmelt öeldes soovida"
text158,Müügitöö on ühelt poolt töökus ja teiselt poolt oskus. 
text159,"Müümine on oskus ning maailmas on väga vähe ettevõtteid, mille kogemustepagas selles valdkonnas on suurem kui Southwesternil."
text160,"Vaatame seminaril otsa esinemishirmu tekkemehhanismidele ja viisidele, kuidas lühikeses ja pikas perspektiivis ärevusega paremini toime tulla."
text161,"Samuti vaatame, milline on hea avalik esinemine ja kuidas oma esinemisoskust parandada."
text162,"Kui soovid oma avaliku esinemise oskusi parandada ning esinemisärevuse seljatada, on seminar sulle heaks sissejuhatuseks teema ettevõtmisel."
text163,"Aga ka käsu koostamise ja andmise oskus on tsiviilelus kasulik, sest tegu on konkreetse juhisega ülesande lahendamiseks ning selle andmisega kaasneb ka enesekindlus ja usk sellesse, et ülesanne saab lahendatud."
text164,"Töötoas saad teada, kuidas tunda ennast networkingu käigus enesekindlana ning leida sobivaid kontakte."
text165,"Eestlasele on kontaktide leidmine ja suhtlemine üritustel keeruline ülesanne, kuid kõik networkingu põhitõed on õpitavad."
text166,"Töötoa turvalises keskkonnas õpid looma tugevaid ja väärtuslikke võrgustikke ning lisaks saad teada, milliseid vigu networkimisel vältida."
text167,Tule arenda ennast ning koos sellega oma ettevõtlust - välisturgudele minekul tuleb networkingu oskus ainult kasuks.
text168,"See on oskus olla teadlik end mõjutavatest emotsioonidest, võime seda teadmist kasutada arusaadavalt ning mõistlikult nii eneseväljendamisel kui ka suhetes teistega. "
text169,"Suhtles aktiivselt, leidis õige Prantsuse esindaja, panustas ja panustab endiselt sotsiaalmeediasse, toodete degustatsioonidesse, erinevatesse võimalustesse tooteid esile tõsta."
text170,"Ei tasu unustada, et poeketti saamine on vaid esimene etapp, seejärel tuleb sama intensiivselt panustada sellesse, et toode riiulitel püsiks."
text171,Kokkulepped paljude piirkonna ettevõtetega parktikabaasideks olemiseks ja arvukad külalisõpetajad erinevatelt elualadelt kinnitavad õpetaja oskust luua toimivaid koostöösuhteid eelkõige õpilaste arengueesmärke silmas pidades. 
text172,"Ehitame üles koostööd, mitte ei võistle omavahel, sest Euroopas teatakse meie tootjaid Baltikumi nime all,“ rääkis Grikis."
text173,"Ei tasu unustada, et poeketti saamine on vaid esimene etapp, seejärel tuleb sama intensiivselt panustada sellesse, et toode riiulitel püsiks."
text174,"See on oskus olla teadlik end mõjutavatest emotsioonidest, võime seda teadmist kasutada arusaadavalt ning mõistlikult nii eneseväljendamisel kui ka suhetes teistega. "
text175,"Meie noored oskavad üksteisega paremini arvestada ja stressirohketes olukordades toime tulla nii, et meeskond jätkab efektiivset tegutsemist."
text176,Suurepärane planeerimisoskus ja teiste soovidega arvestamine on teinud temast kõrgelt hinnatud noorte ja haridusasutustega suhtleja.
text177,“Parimates meeskondades kuulavad meeskonna liikmed üksteist ning mõistavad teiste tundeid ja vajadusi.”
text178,"Kuidas püstitada meeskonnaga eesmärke nii, et see toetab nende saavutamist sõltumata asukohast?"
text179,"Ühiselt vaadatakse üle, kuidas ja milline eesmärkide puu luua ning kuidas tulemusi hinnata ning tagada edusammudega seotud kommunikatsioon."
text180,Tähelepanu väärib tema oskus leida rahvusvahelise ambitsiooniga ideedele erinevate projektide kaudu rahastus.
text181,"Päeva tulemusena arendate:
Meeskonnatööd
Strateegilist mõtlemist
Juhtimisoskust
Otsustusoskus"
text182,"Teiseks on mõistlik luua just oma ettevõttele sobiv ajatemplite kasutamise lahendus, sest tembeldamine ei ole ühekordne ja see vajadus tekib järgnevate dokumentide suhtes ka tulevikus."
text183,"Me anname neile planeerimisoskuse, grupidünaamikast arusaamise ja veel väga palju teoreetilisi teadmisi."
text184,"Ent tulevikus muutub edukaks saamisel järjest olulisemaks ka kaugemale ja enda kõrvale nägemine, tulevikusignaalide tajumine ja sellega arvestamise oskus,” ütles president Kersti Kaljulaid."
text185,Tähelepanu väärib tema oskus leida rahvusvahelise ambitsiooniga ideedele erinevate projektide kaudu rahastus.
text186,Suurepärane planeerimisoskus ja teiste soovidega arvestamine on teinud temast kõrgelt hinnatud noorte ja haridusasutustega suhtleja.
text187,"Päeva tulemusena arendate:
Meeskonnatööd
Strateegilist mõtlemist
Juhtimisoskust
Otsustusoskus"
text188,"Google pakub koostöös Majandus- ja kommunikatsiooniministeeriumi (MKM), Ettevõtluse Arendamise Sihtasutuse (EAS) ja Maakondlike Arenduskeskustega kõigile huvilistele tasuta koolitusi, et suurendada nende teadmisi näiteks veebilehe või -poe arendamisest, digimaailmas nähtavuse tõstmisest, sotsiaalmeedia turundusest, digistrateegiate koostamisest ja paljust muust."
text189,"Oskuse luua selge ja kaasav strateegia, saavutada inimeste pühendumus, et viia ellu püstitatud eesmärgid ning juhtida muutusi."
text190,"Üks külg on kindlasti hanketegevused. Eesti ettevõtjad tagavad meile suure osa vajalikust materjalist, alates toidust sööklas kuni kasarmute ehituseni. "
text191,"Kõige suurem ja tähtsam osa on koostöö seoses reservväega, sest me tahame ettevõtjatelt erinevates olukordades saada inimressurssi."
text192,"Seda enam, et kui peaks tekkima reaalne olukord, kus reservvägi tuleb kokku kutsuda üleöö ja teadmata perioodiks, siis normaalne elu ning ka äritegevus saavad tugevalt häiritud, kuid selle vältimiseks me saame juba praegu plaani pidada ja võimalikke riske maandada."
text193,"Ent tulevikus muutub edukaks saamisel järjest olulisemaks ka kaugemale ja enda kõrvale nägemine, tulevikusignaalide tajumine ja sellega arvestamise oskus,” ütles president Kersti Kaljulaid."
text194,"Tema tugevusteks on koostööle orienteeritus, uuendusmeelsus ning oskus lahendada probleeme kõigile osapooltele sobivalt."
text195,"EY Aasta Ettevõtja konkursi patroon president Alar Karis lausus oma videotervituses, et Eesti ettevõtjad on vastupidavad ja sihikindlad, kes oskavad näha ja kasutada uusi võimalusi ka seal, kus teised käega löövad."
text196,"Oluline on tähelepanu pöörata teeninduskultuurile, sest mitte alati ei ole Keeleametile laekunud kaebuse peamiseks põhjuseks keeleoskuse puudumine, vaid teeninduskultuuri puudumine."
text197,"Kõik töökollektiivid, kuhu asub tööle Ukraina sõjapõgenikke, võiksid neid toetada eesti keele õppimisel."
text198,"Kui aga aja möödudes selgub, et sõjapõgenikust töötajal tuleb jääda Eestisse pikemaks ajaks, näiteks mitmeks aastaks, ootame ka tööandjalt initsiatiivi, et tagada et nende töötajate nõutaval tasemel eesti keele oskus."
text199,"Meeskond FictionFeel on näidanud üles sihikindlust idee arendamisel ja elluviimisel, tulnud pühendunud meeskonnana hästi toime alustava ettevõtja väljakutsetega ja kasutanud oskuslikult lisaks STARTER programmile kogu start-up ökosüsteemi võimalusi idee arendamisel ning teadmiste ja kogemuste omandamisel."
text200,"Meeskond FictionFeel on näidanud üles sihikindlust idee arendamisel ja elluviimisel, tulnud pühendunud meeskonnana hästi toime alustava ettevõtja väljakutsetega ja kasutanud oskuslikult lisaks STARTER programmile kogu start-up ökosüsteemi võimalusi idee arendamisel ning teadmiste ja kogemuste omandamisel."
text201,"Aktiivse ja innuka uuendajana lööb tema silm kohe särama, kui on võimalik lastele millegi uue õpetamisel kasutada uudseid meetodeid ja vahendeid."
text202,"Marje Vaan on Pärnu Vanalinna Põhikooli huvijuht, kes innovaatilise ja ettevõtliku õpetajana on   ettevõtlusõppe oskuslikult lõiminud erinevate õppeainetega. Marje on loonud koolis süsteemi õpilaste ettevõtlikkuse arendamiseks ja ettevõtlusõppe juurutamiseks. Ta teeb koostööd erinevate partneritega väljapool kooli ning nõustab ja toetab kolleege ettevõtlusõppe lõimimisel ainetundidesse."
text203,"Marje Vaan on Pärnu Vanalinna Põhikooli huvijuht, kes innovaatilise ja ettevõtliku õpetajana on   ettevõtlusõppe oskuslikult lõiminud erinevate õppeainetega. Marje on loonud koolis süsteemi õpilaste ettevõtlikkuse arendamiseks ja ettevõtlusõppe juurutamiseks. Ta teeb koostööd erinevate partneritega väljapool kooli ning nõustab ja toetab kolleege ettevõtlusõppe lõimimisel ainetundidesse."
text204,"Modernworkplacelearning.com-i küsitluse järgi on töötajate kõige eelistatumad viisid õppida igapäevase töö käigus, kolleegidega kogemuste jagamine (peer learning), ise veebist teadmisi kogudes, aga ka juhi tagasiside ja juhendamine."
text205,Mitmekülgne ja ennastjuhtiv töötaja on väärtus igale organisatsioonile ning arengu toetamine oluline osa töötaja karjääriteekonna kujundamisest.
text206,"Tisleritööd iseloomustab pigem iseseisev tegutsemine, mis nõuab oskust oma tegevust kavandada ja suurt enesedistsipliini."
text207,Mitmekülgne ja ennastjuhtiv töötaja on väärtus igale organisatsioonile ning arengu toetamine oluline osa töötaja karjääriteekonna kujundamisest.
text208,"On leitud, et kõige enam suurendab töötaja karjääri kohanemisvõimet oskus vastavalt vajadusele kasutada erinevaid enda arendamise viise. Näiteks kogenumatelt kolleegidelt tagasisidet küsides, iseseisvalt infot juurde otsides, võimaluste avanedes täiendus- ja ümberõppes osaledes."
text209,"Modernworkplacelearning.com-i küsitluse järgi on töötajate kõige eelistatumad viisid õppida igapäevase töö käigus, kolleegidega kogemuste jagamine (peer learning), ise veebist teadmisi kogudes, aga ka juhi tagasiside ja juhendamine."
text210,"On leitud, et kõige enam suurendab töötaja karjääri kohanemisvõimet oskus vastavalt vajadusele kasutada erinevaid enda arendamise viise. Näiteks kogenumatelt kolleegidelt tagasisidet küsides, iseseisvalt infot juurde otsides, võimaluste avanedes täiendus- ja ümberõppes osaledes."
text211,"Modernworkplacelearning.com-i küsitluse järgi on töötajate kõige eelistatumad viisid õppida igapäevase töö käigus, kolleegidega kogemuste jagamine (peer learning), ise veebist teadmisi kogudes, aga ka juhi tagasiside ja juhendamine."
text212,"Võttes arvesse logistikasektori ettevõtete sidusust äriprotsesside läbiviimisel tarneahelas, samuti paralleelsete tarneahelate olemasolu, on koostöö kaudu võimalik luua märgatavat ressursside kokkuhoidu ning tõsta efektiivsust."
text213,"Meeskonnaliikmed arendavad oma teadmisi järgmistes ärivaldkondades:
Turundus- ja müügijuhtimine
Ostu- ja logistika juhtimine
Tootmise- ja kvaliteedijuhtimine
Finantsjuhtimine
Personalijuhtimine"
text214,"Võttes arvesse logistikasektori ettevõtete sidusust äriprotsesside läbiviimisel tarneahelas, samuti paralleelsete tarneahelate olemasolu, on koostöö kaudu võimalik luua märgatavat ressursside kokkuhoidu ning tõsta efektiivsust."
text215,"Meeskonnaliikmed arendavad oma teadmisi järgmistes ärivaldkondades:
Turundus- ja müügijuhtimine
Ostu- ja logistika juhtimine
Tootmise- ja kvaliteedijuhtimine
Finantsjuhtimine
Personalijuhtimine"
text216,"Päeva tulemusena arendate:
Meeskonnatööd
Strateegilist mõtlemist
Juhtimisoskust
Otsustusoskus"
text217,"Metsanduse juhtide ja tippspetsialistide, sh ostu- ja müügijuhtide olulisteks erialasteks oskusteks ja teadmisteks on laiaulatuslikud metsabioloogia ja mullastikualased teadmised, metsaressursi pikaajalise strateegilise planeerimise oskus ja kontseptuaalne mõtlemisoskus. Neil on võime käsitleda metsa majandamist ühe osana majandusest ja ettevõtlusest ning näha ja planeerida kaugele ette, sest metsanduses ei toimu protsessid ühe inimpõlve jooksul."
text218,"Metsanduse juhtidel ja tippspetsialistidel jääb praegu enim puudu oskusest näha metsamajandamist ja puidutööstust ühe osana kogu majandusest ja ettevõtlusest, probleemilahendamise oskusest, ideede genereerimise ning inimeste juhtimise oskusest."
text219,"Samuti on puudu ruumilise ja strateegilise planeerimise võimekusest, kontseptuaalsest mõtlemisoskusest ning finantsnäitajate lugemise oskusest."
text220,"Nende kasvava tähtsusega üldiseks oskuseks on strateegilise planeerimise oskus, kontseptuaalne mõtlemisoskus, suhtlemisoskus ja valdkondlike õigusaktide tundmine ning IKT-lahenduste rakendamine. "
text221,"Üldistest oskustest jääb puudu analüütilise mõtlemise võimest, algteadmistest ruumilise planeerimise kohta ja kontseptuaalsest mõtlemisoskusest."
text222,"Puidu- või mööblitööstuse juhtide kasvava tähtsusega erialasteks oskusteks on valdkonnaspetsiifilise ettevõtluse hea tundmine, pikaajaline planeerimine, tööstuse tootmisprotsessi tundmine ja selle töö korraldamine tootmises algusest lõpuni."
text223,"Kasvava tähtsusega üldisteks oskusteks on analüüsivõime , läbirääkimise ja veenmise oskus, sihikindlus , eesmärkide seadmine, probleemilahendamise, meeskonnatöö ja koostööoskus ning oskus tellida ja rakendada valdkonnaspetsiifilisi IKT-lahendusi."
text224,"Puitkonstruktsioonide projekteerijate kasvava tähtsusega erialasteks oskusteks ja teadmisteks on toodete, sh puitmajade projekteerimise eripärade tundmine, puitmaterjali eripärade ja materjalitehnoloogia tundmine, tööprotsesside tundmine, jooniste koostamine ja konstrueerimine, jooniste lugemise oskus nii käsitsi kui arvutil, CNC töötlemiskeskustele programmide koostamine, toodete projekteerimine, joonestamise ja projekteerimistarkvaraga töötamine, sh targa tellija kompetents – milline tarkvara, milliseks lahenduseks ja milliste tingimustega sobib, millised kulutused on efektiivsed  ning millist infot süsteemist koguda tasub."
text225,"Tootearendajate kasvava tähtsusega erialasteks oskusteks ja teadmisteks on puitmaterjali eripärade ja materjalitehnoloogia tundmine, tootmistehnoloogia tundmine, joonestamine ja projekteerimine, sh CAD-CAM-i, MathCAD-i ja 3D projekteerimine."
text226,"Nende kasvava tähtsusega üldisteks oskusteks ja hoiakuteks on analüüsivõime, ruumiline mõtlemine, planeerimise oskus, finantside lugemisoskus ja eelarvestamine , ajajuhtimine, suhtlemisoskus ja töötamine inimestega ning kirjutamine ja raporteerimine."
text227,"Tehnoloogi, sh mööblitoodete tehnoloogi kasvava tähtsusega erialasteks oskusteks ja teadmisteks on oma valdkonna toodete tootearenduse tehniliste eripärade tundmine, puitmaterjali eripärade ja materjalitehnoloogia tundmine, tööprotsesside tundmine, jooniste koostamine ja konstrueerimine, jooniste lugemise oskus nii käsitsi kui arvutil  ning joonestamise ja projekteerimistarkvaraga töötamine."
text228,"Tehnik-joonestajate kasvava tähtsusega erialasteks oskusteks ja teadmisteks on toodete, sh puitmajade projekteerimise eripärade tundmine, puitmaterjali eripärade ja materjalitehnoloogia tundmine, tööprotsesside tundmine, jooniste koostamine ja konstrueerimine, jooniste lugemise oskus (nii käsitsi kui arvutil joonistatud ) ning joonestamise ja projekteerimistarkvaraga töötamine."
text229,Pehme mööbli valmistajatel on puudu tööstuses uue pehme mööbli või selle osade koostamisega seotud käelistest oskustest   ja oma osa mõistmisest tootmise tervikprotsessis.
text230,"Olulised on teadmised puidukuivatamisest, aspiratsioonist, arusaamine detailide ja toodete valmistamise ja viimistlemise tsüklist ning mõistmine, mida tehti enne, kui detail või toode viimistlusse läheb."
text231,"Vajaka jääb ka materjalide tundmisest  ja materjalide säästlikust kasutamisest, teadmistest puidukuivatamisest ja aspiratsioonist, arusaamisest detailide ja toodete valmistamise ja viimistlemise tsüklist, mõistmisest, mida tehti enne, kui detail või toode viimistlusse läheb."
text232,"Puitdetailide viimistlejate kasvava tähtsusega erialasteks oskusteks ja teadmisteks on materjalide tundmine  ja säästlikult kasutamine, puidukuivatamine, aspiratsioon, arusaamine detailide ja toodete valmistamise ja viimistlemise tsüklist ning detailidele ja toodetele esitatavatest kvaliteedinõuetest, mõistmine, mida tehti enne, kui detail või toode viimistlusse läheb."
text233,"Puidupingioperaatoritel jääb puudu teadmistest tootmisprotsessidest ja nende juhtimisest, materjalide ja toodete tundmisest, selle kohta, milline puit sobib milliseks tooteks  ning kuidas seda kõige efektiivsemalt saada."
text234,"Puitplaatide tootmise, vineeri töötlemisega ja saematerjalide tootmisega seotud liinioperaatoritel jääb puudu teadmistest tootmisprotsessidest ja nende juhtimise, materjalide  ja toodete tundmisest, selle kohta, milline puit sobib milliseks tooteks ja kuidas seda kõige efektiivsemalt saada."
text235,"Metsanduse juhtide ja tippspetsialistide, sh ostu- ja müügijuhtide olulisteks erialasteks oskusteks ja teadmisteks on laiaulatuslikud metsabioloogia ja mullastikualased teadmised, metsaressursi pikaajalise strateegilise planeerimise oskus ja kontseptuaalne mõtlemisoskus. Neil on võime käsitleda metsa majandamist ühe osana majandusest ja ettevõtlusest ning näha ja planeerida kaugele ette, sest metsanduses ei toimu protsessid ühe inimpõlve jooksul."
text236,"Lisaks headele metsamajanduslikele teadmistele on olulised teadmised puidu omadustest, toodetest ning nende turustamisest, aga ka logistika põhimõtete tundmine ja ladude  ning teede planeerimise oskus."
text237,"Samuti on puudu ruumilise ja strateegilise planeerimise võimekusest, kontseptuaalsest mõtlemisoskusest ning finantsnäitajate lugemise oskusest."
text238,"Nende kasvava tähtsusega üldiseks oskuseks on strateegilise planeerimise oskus, kontseptuaalne mõtlemisoskus, suhtlemisoskus ja valdkondlike õigusaktide tundmine ning IKT-lahenduste rakendamine. "
text239,"Puidu- või mööblitööstuse juhtide kasvava tähtsusega erialasteks oskusteks on valdkonnaspetsiifilise ettevõtluse hea tundmine, pikaajaline planeerimine, tööstuse tootmisprotsessi tundmine ja selle töö korraldamine tootmises algusest lõpuni."
text240,"Lisaks headele metsamajanduslikele teadmistele on olulised teadmised puidu omadustest, toodetest ning nende turustamisest, aga ka logistika põhimõtete tundmine ja ladude  ning teede planeerimise oskus."
text241,"Lisaks headele metsamajanduslikele teadmistele on olulised teadmised puidu omadustest, toodetest ning nende turustamisest, aga ka logistika põhimõtete tundmine ja ladude  ning teede planeerimise oskus."
text242,"Müügi- ja ostujuhtidel on eriti tähtsal kohal üldised oskused ja teadmised. Kasvava tähtsusega üldisteks oskusteks on võõrkeelte valdamine, riskide juhtimine, logistika põhimõtete tundmine ja strateegiline ladude planeerimise oskus, meeskonnatöö oskus ning järjest kasvav valdkonnaspetsiifiliste IKT-lahenduste tellimise  ja rakendamise oskus."
text243,"Lisaks headele metsamajanduslikele teadmistele on olulised teadmised puidu omadustest, toodetest ning nende turustamisest, aga ka logistika põhimõtete tundmine ja ladude  ning teede planeerimise oskus."
text244,"Kasvava tähtsusega üldisteks oskusteks on analüüsivõime , läbirääkimise ja veenmise oskus, sihikindlus , eesmärkide seadmine, probleemilahendamise, meeskonnatöö ja koostööoskus ning oskus tellida ja rakendada valdkonnaspetsiifilisi IKT-lahendusi."
text245,"Üldistest teadmistest, oskustest ja hoiakutest jätavad soovida kohuse ja vastutustunne ja erialaste IKT-lahenduste kasutamine  –programmide kirjutamise oskus  (programmeerimine), teadmised matemaatikast, läbirääkimiste oskus ja ettevõtlikkus."
text246,"Lisaks headele metsamajanduslikele teadmistele on olulised teadmised puidu omadustest, toodetest ning nende turustamisest, aga ka logistika põhimõtete tundmine ja ladude  ning teede planeerimise oskus."
text247,"Kasvava tähtsusega üldisteks oskusteks on analüüsivõime , läbirääkimise ja veenmise oskus, sihikindlus , eesmärkide seadmine, probleemilahendamise, meeskonnatöö ja koostööoskus ning oskus tellida ja rakendada valdkonnaspetsiifilisi IKT-lahendusi."
text248,Üldistest oskustest ja hoiakutest on kasva tähtsusega IKT-lahenduste kasutamine ja rutiinitaluvus.
text249,"Kasvavateks üldisteks oskusteks on protsesside, ressursside, riskide ja inimeste juhtimise oskus, läbirääkimise oskus, sihikindlus ja eesmärkide seadmine, meeskonnatöö oskus, keelte valdamine ning oskus tellida ja rakendada valdkonnaspetsiifilisi IKT-lahendusi. "
text250,"Metsanduse juhtidel ja tippspetsialistidel jääb praegu enim puudu oskusest näha metsamajandamist ja puidutööstust ühe osana kogu majandusest ja ettevõtlusest, probleemilahendamise oskusest, ideede genereerimise ning inimeste juhtimise oskusest."
text251,"Üldistest oskustest ja hoiakutest on puudu teadmistest töö efektiivsemaks muutmise võimalustest, materjali efektiivsest kasutamisest, planeerimise oskusest ja ajajuhtimisest, suhtlemisoskusest, meeskonnatöö organiseerimisest ning tööohutusest ja töötervishoidust ning isikukaitsevahendite kasutamisest."
text252,"Nende kasvava tähtsusega üldisteks oskusteks ja hoiakuteks on analüüsivõime, ruumiline mõtlemine, planeerimise oskus, finantside lugemisoskus ja eelarvestamine , ajajuhtimine, suhtlemisoskus ja töötamine inimestega ning kirjutamine ja raporteerimine."
text253,"Kasvavateks üldisteks oskusteks on protsesside, ressursside, riskide ja inimeste juhtimise oskus, läbirääkimise oskus, sihikindlus ja eesmärkide seadmine, meeskonnatöö oskus, keelte valdamine ning oskus tellida ja rakendada valdkonnaspetsiifilisi IKT-lahendusi. "
text254,Vähesed on oskused puiduvarumise korraldamise ja puidu mahu mõõtmise osas.
text255,"Puidu- või mööblitööstuse juhtide kasvava tähtsusega erialasteks oskusteks on valdkonnaspetsiifilise ettevõtluse hea tundmine, pikaajaline planeerimine, tööstuse tootmisprotsessi tundmine ja selle töö korraldamine tootmises algusest lõpuni."
text256,"Puidupingioperaatoritel jääb puudu teadmistest tootmisprotsessidest ja nende juhtimisest, materjalide ja toodete tundmisest, selle kohta, milline puit sobib milliseks tooteks  ning kuidas seda kõige efektiivsemalt saada."
text257,"Puitplaatide tootmise, vineeri töötlemisega ja saematerjalide tootmisega seotud liinioperaatoritel jääb puudu teadmistest tootmisprotsessidest ja nende juhtimise, materjalide  ja toodete tundmisest, selle kohta, milline puit sobib milliseks tooteks ja kuidas seda kõige efektiivsemalt saada."
text258,"Kasvavateks üldisteks oskusteks on protsesside, ressursside, riskide ja inimeste juhtimise oskus, läbirääkimise oskus, sihikindlus ja eesmärkide seadmine, meeskonnatöö oskus, keelte valdamine ning oskus tellida ja rakendada valdkonnaspetsiifilisi IKT-lahendusi. "
text259,"Kasvava tähtsusega üldisteks oskusteks on analüüsivõime , läbirääkimise ja veenmise oskus, sihikindlus , eesmärkide seadmine, probleemilahendamise, meeskonnatöö ja koostööoskus ning oskus tellida ja rakendada valdkonnaspetsiifilisi IKT-lahendusi."
text260,"Nende kasvava tähtsusega üldisteks oskusteks, teadmisteks ja hoiakuteks on meeskonnatöö oskus."
text261,"Kasvava tähtsusega üldisteks oskusteks, teadmisteks ja hoiakuteks on meeskonnatöö oskus."
